{
  "format": "retrodos.program",
  "manifestVersion": 1,
  "id": "retrodos.calculator",
  "code": "CALC",
  "name": "電卓",
  "description": "四則演算・括弧・メモリー",
  "version": "0.4.0",
  "category": "tools",
  "icon": "calculator",
  "order": 40,
  "aliases": [],
  "argument": {
    "kind": "expression"
  },
  "entry": {
    "runtime": "builtin",
    "module": "calculator"
  }
}
